### ISSUE TITLE
[Problem]: Cross subnet AirPlay 2 doesn't work if Shairport host has IPv6

### ISSUE THREAD

**Issue by pwood** [mikebrady/shairport-sync#1753]
### What happened?

Playing audio between an iPhone 13 Pro and Shairport-sync with AirPlay 2 (running on Raspberry Pi OS) doesn't seem to work if the Pi has a valid global IPv6 configuration (supposition) and they are on different subnets. mDNS routing/reflecting is configured correctly and works for a whole host of other Apple HomeKit (scrypted/HomeKit Secure Video to HomePod) functionality with the devices having IPv6.

You've heard this kind of setup before reading previous issues, two networks, one for trusted clients and one for IOT devices. Traffic is allowed between them as appropriate. IPv6 is configured correctly all the way back to the ISP and all devices (that are capable) have valid global IPv6 addresses.

If I place the iPhone on the same network as Shairport, then it works. If the I place the phone on a different network it no longer does. If I disable IPv6 on the Raspberry Pi running Shairport, then the phone works when on the different network. 

With IPv6 configured on the Pi, looking at logs from Shairport and tcpdump traces it looks like Shairport believes that the audio will come in via IPv6, but I believe it actually does via IPv4?

It feels like theres an miscommunications somewhere about which IP addresses should be used and shairport is receiving audio it's not expecting.

Network config for logs:

Trusted Device Network:
10.10.4.0/22 - iPhone is 10.10.5.10 or 2001:XXXX:XXXX:40:6423:14a7:2f02:c7c8

IOT Network:
10.10.8.0/24 - Shairport is 10.10.8.214 or 2001:XXXX:XXXX:80:ef27:3116:818b:a46e

Happy to provide anything more that might be required - disabling IPv6 is doable, but it'd be nice for this to work with it.

### Relevant log output

```shell
Shairport:

      57.335045968 "rtsp.c:2902" Connection 1: AP2 PTP connection from 2001:XXXX:XXXX:40:6423:14a7:2f02:c7c8:52584 ("Electron") to self at 2001:XXXX:XXXX:80:ef27:3116:818b:a46e:7000.

tcpdump:

NQPTP Traffic:
16:37:30.703420 IP 10.10.5.10.319 > 10.10.8.214.319: UDP, length 44
16:37:30.703471 IP 10.10.5.10.320 > 10.10.8.214.320: UDP, length 96
16:37:30.726570 IP 10.10.5.10.320 > 10.10.8.214.320: UDP, length 76
16:37:30.726595 IP 10.10.5.10.320 > 10.10.8.214.320: UDP, length 106

Direct Control Traffic:
16:37:30.653962 IP6 2001:XXXX:XXXX:40:6423:14a7:2f02:c7c8.52512 > 2001:XXXX:XXXX:80:18ce:6261:dfe8:e00f.7000: Flags [P.], seq 1955:2040, ack 5406, win 2048, options [nop,nop,TS val 157770363 ecr 2900212513], length 85
16:37:30.657169 IP6 2001:XXXX:XXXX:80:18ce:6261:dfe8:e00f.7000 > 2001:XXXX:XXXX:40:6423:14a7:2f02:c7c8.52512: Flags [.], ack 2040, win 4093, options [nop,nop,TS val 2900214552 ecr 157770363], length 0
16:37:30.659013 IP6 2001:XXXX:XXXX:80:18ce:6261:dfe8:e00f.7000 > 2001:XXXX:XXXX:40:6423:14a7:2f02:c7c8.52512: Flags [P.], seq 5406:5641, ack 2040, win 4096, options [nop,nop,TS val 2900214553 ecr 157770363], length 235
16:37:30.661217 IP6 2001:XXXX:XXXX:40:6423:14a7:2f02:c7c8.52512 > 2001:XXXX:XXXX:80:18ce:6261:dfe8:e00f.7000: Flags [.], ack 5641, win 2044, options [nop,nop,TS val 157770371 ecr 2900214553], length 0
```

### System Information.

RaspberryPi Nano 2 W with PHATdac.

### Configuration Information.

```shell
>> Display Config Start.

From "uname -a":
 Linux raspberrypi 6.1.0-rpi4-rpi-v8 #1 SMP PREEMPT Debian 1:6.1.54-1+rpt2 (2023-10-05) aarch64 GNU/Linux

From /etc/os-release:
 Debian GNU/Linux 12 (bookworm)

From /sys/firmware/devicetree/base/model:
 Raspberry Pi Zero 2 W Rev 1.0

Shairport Sync Version String:
 4.3.2-1-g90c03bf0-AirPlay2-smi10-OpenSSL-Avahi-ALSA-soxr-sysconfdir:/etc

Command Line:
 shairport-sync --displayConfig

Configuration File:
 /etc/shairport-sync.conf

Configuration File Settings:
 general :
 {
   name = "Kitchen";
 };
 pw :
 {
 };

>> Display Config End.
>> Goodbye!
```

### PulseAudio or PipeWire installed?

- [ ] Check if your system uses a Sound Server.

### How did you install Shairport Sync?

Built from source

### Check previous issues

- [X] Confirm

**Comment by mikebrady** [comment]
Thanks for the post. 

From memory, I think the problem might be slightly different. AFAIK, an iOS device will pick a local IPv6 address to transmit from whenever it's available, even if a global address is available. However, using Avahi, Shairport Sync will advertise itself as being available on a global IPv6 address if available. The iOS device, being on a local IPv6 address, will not be able to connect to Shairport Sync on the global IPv6 address.

Does that sound plausible in your situations?

**Comment by pwood** [comment]
Hey @mikebrady - thanks for the really rapid response. Hope you're enjoying your weekend too. 🤣

I don't think it's the case - I've just done a bit more snooping, in the failure case - the phone has established a TCP connection with shairport-sync on a random high numbered port - the phone sends 1518 byte frames, shairports host responds with acks... I'm assuming that's the actual audio channel?

```
peter@raspberrypi:~ $ sudo netstat -pante
tcp6  2174433      0 2001:XXXX:XXXX:80::57983 2001:XXXX:XXXX:40::52975 ESTABLISHED 995        610        621/shairport-sync

18:12:30.548370 IP6 2001:XXXX:XXXX:40:600c:b956:38e0:694d.52975 > 2001:XXXX:XXXX:80:ef27:3116:818b:a46e.57983: Flags [.], seq 325584:327012, ack 1, win 8211, options [nop,nop,TS val 2729404442 ecr 4129319745], length 1428
18:12:30.548385 IP6 2001:XXXX:XXXX:40:600c:b956:38e0:694d.52975 > 2001:XXXX:XXXX:80:ef27:3116:818b:a46e.57983: Flags [.], seq 327012:328440, ack 1, win 8211, options [nop,nop,TS val 2729404442 ecr 4129319746], length 1428
18:12:30.548393 IP6 2001:XXXX:XXXX:40:600c:b956:38e0:694d.52975 > 2001:XXXX:XXXX:80:ef27:3116:818b:a46e.57983: Flags [P.], seq 328440:329458, ack 1, win 8211, options [nop,nop,TS val 2729404442 ecr 4129319746], length 1018
18:12:30.549666 IP6 2001:XXXX:XXXX:80:ef27:3116:818b:a46e.57983 > 2001:XXXX:XXXX:40:600c:b956:38e0:694d.52975: Flags [.], ack 291312, win 25566, options [nop,nop,TS val 4129319752 ecr 2729404433], length 0
18:12:30.549685 IP6 2001:XXXX:XXXX:80:ef27:3116:818b:a46e.57983 > 2001:XXXX:XXXX:40:600c:b956:38e0:694d.52975: Flags [.], ack 294168, win 25566, options [nop,nop,TS val 4129319752 ecr 2729404433], length 0
18:12:30.549687 IP6 2001:XXXX:XXXX:80:ef27:3116:818b:a46e.57983 > 2001:XXXX:XXXX:40:600c:b956:38e0:694d.52975: Flags [.], ack 297024, win 25566, options [nop,nop,TS val 4129319752 ecr 2729404434], length 0
18:12:30.549689 IP6 2001:XXXX:XXXX:80:ef27:3116:818b:a46e.57983 > 2001:XXXX:XXXX:40:600c:b956:38e0:694d.52975: Flags [.], ack 301308, win 25566, options [nop,nop,TS val 4129319753 ecr 2729404434], length 0
18:12:30.549691 IP6 2001:XXXX:XXXX:80:ef27:3116:818b:a46e.57983 > 2001:XXXX:XXXX:40:600c:b956:38e0:694d.52975: Flags [.], ack 304164, win 25566, options [nop,nop,TS val 4129319753 ecr 2729404437], length 0
```

[Several Hours Later]

Now the kido is in bed, I've captured a couple of outputs from shairport-sync with `-vv`, one with IPv6 enabled and one disabled. I do also have pcap's of all phone traffic at both times - which I can share, but would need to do privately, much harder to sanitize than logs.

An obvious difference between the two is that I never see `"rtp.c:2483" Play started.` in the IPv6 enabled version - but the phone does start sending data to the buffered TCP dataport as requested - over IPv6.

[shairportlog-failure-cross-subnet-ipv6-enabled.txt](https://github.com/mikebrady/shairport-sync/files/13199041/shairportlog-failure-cross-subnet-ipv6-enabled.txt)
[shairportlog-success.txt](https://github.com/mikebrady/shairport-sync/files/13199042/shairportlog-success.txt)

**Comment by mikebrady** [comment]
Thanks -- this is going to need coffee! Unfortunately, I do not have globally routed IPv6 anymore, so I can't test this directly. But let me have a dig through your traffic logs...

**Comment by mikebrady** [comment]
I took a look at this, and it just seems as if the source -- the iPhone -- just hasn't started sending audio in the IPv6 cross-subnet case. This is not really too surprising, as the AirPlay service is meant to be local (and IIRC, Apple took steps to make sure it stayed local many years ago in IPv4). What is a bit surprising that it works across your IPv4 subnets. I wonder if a different idea of subnet (e.g. a /16 subnet) is used...

**Comment by t-dubbb** [comment]
Hey, I wanted to chime in on this. I actually don't use Shairport, but I am seeing the same behavior with Airplay not working across subnets if IPv6 is enabled. I have an x86 router appliance that has 2 interfaces, 1 for my LAN and 1 for IoT devices. I am using the "udpbroadcastrelay" software to do mDNS/SSDP reflection across the interfaces. At the moment i have no firewall rules in place, just for testing. I am seeing the exact same behavior as the OP, with IPv4 working fine with ports 319/320 but IPv6 failing with port 7000. It's the exact same symptom as well, the phone looks like it connects to the Airplay device (a Sonos in this case) and it looks like it is playing, but no audio is coming through. I'm not sure, but it feels related in some way. In the meantime I've just disabled IPv6 and everything is working fine. (*unleash the hounds from reddit.com/r/IPv6* 😂)

Will keep an eye on this thread!
